{
  "_schema_version": 1,
  "slug": "warning-filled",
  "kit": "dskit",
  "synced_at": "2026-07-08T09:23:58.517Z",
  "source": {
    "fileKey": "l8biHxfarNi1I2RMvVxVOK",
    "nodeId": "14719:1075"
  },
  "quality": {
    "nodesTotal": 2,
    "nodesNormalized": 1,
    "ratio": 0.5,
    "degraded": [
      {
        "name": "warning-filled",
        "reason": "layoutMode:NONE"
      }
    ]
  },
  "root": {
    "name": "warning-filled",
    "kind": "container",
    "id": "14719:1075",
    "normalizable": false,
    "rawHint": {
      "layoutMode": "NONE",
      "x": 691,
      "y": -536,
      "constraints": {
        "vertical": "TOP",
        "horizontal": "LEFT"
      }
    },
    "children": [
      {
        "name": "Vector",
        "kind": "vector",
        "id": "14719:1073",
        "appearance": {
          "background": "#d27b00"
        }
      }
    ]
  }
}
