{
  "_schema_version": 1,
  "slug": "help-laptop",
  "kit": "dskit",
  "synced_at": "2026-07-08T09:23:58.517Z",
  "source": {
    "fileKey": "l8biHxfarNi1I2RMvVxVOK",
    "nodeId": "14691:457"
  },
  "quality": {
    "nodesTotal": 1,
    "nodesNormalized": 1,
    "ratio": 1,
    "degraded": []
  },
  "root": {
    "name": "help-laptop",
    "kind": "container",
    "id": "14691:457"
  }
}
