{
  "_schema_version": 1,
  "slug": "xl-grid",
  "kit": "dskit",
  "synced_at": "2026-06-30T10:29:57.517Z",
  "source": {
    "fileKey": "l8biHxfarNi1I2RMvVxVOK",
    "nodeId": "12054:30623",
    "variant": "Property=Default"
  },
  "quality": {
    "nodesTotal": 18,
    "nodesNormalized": 18,
    "ratio": 1,
    "degraded": []
  },
  "root": {
    "name": "Property=Default",
    "kind": "container",
    "layout": {
      "axis": "row",
      "gap": "16px",
      "padding": {
        "top": "0px",
        "right": "160px",
        "bottom": "0px",
        "left": "160px"
      },
      "align": {
        "main": "center",
        "cross": "center"
      },
      "sizing": {
        "h": "hug",
        "v": "fixed"
      }
    },
    "children": [
      {
        "name": "Coumns",
        "kind": "container",
        "layout": {
          "axis": "row",
          "gap": "16px",
          "padding": {
            "top": "0px",
            "right": "0px",
            "bottom": "0px",
            "left": "0px"
          },
          "align": {
            "main": "start",
            "cross": "center"
          },
          "sizing": {
            "h": "hug",
            "v": "fixed"
          }
        },
        "children": [
          {
            "name": "Column",
            "kind": "vector"
          },
          {
            "name": "Column",
            "kind": "vector"
          },
          {
            "name": "Column",
            "kind": "vector"
          },
          {
            "name": "Column",
            "kind": "vector"
          },
          {
            "name": "Column",
            "kind": "vector"
          },
          {
            "name": "Column",
            "kind": "vector"
          },
          {
            "name": "Column",
            "kind": "vector"
          },
          {
            "name": "Column",
            "kind": "vector"
          },
          {
            "name": "Column",
            "kind": "vector"
          },
          {
            "name": "Column",
            "kind": "vector"
          },
          {
            "name": "Column",
            "kind": "vector"
          },
          {
            "name": "Column",
            "kind": "vector"
          },
          {
            "name": "Column",
            "kind": "vector"
          },
          {
            "name": "Column",
            "kind": "vector"
          },
          {
            "name": "Column",
            "kind": "vector"
          },
          {
            "name": "Column",
            "kind": "vector"
          }
        ]
      }
    ]
  }
}
