{
  "_schema_version": 1,
  "slug": "snowflake",
  "kit": "dskit",
  "synced_at": "2026-07-08T09:23:58.517Z",
  "source": {
    "fileKey": "l8biHxfarNi1I2RMvVxVOK",
    "nodeId": "8504:23447"
  },
  "quality": {
    "nodesTotal": 2,
    "nodesNormalized": 1,
    "ratio": 0.5,
    "degraded": [
      {
        "name": "Snowflake",
        "reason": "layoutMode:NONE"
      }
    ]
  },
  "root": {
    "name": "Snowflake",
    "kind": "container",
    "id": "8504:23447",
    "normalizable": false,
    "rawHint": {
      "layoutMode": "NONE",
      "x": 3150,
      "y": 3759,
      "constraints": {
        "vertical": "TOP",
        "horizontal": "LEFT"
      }
    },
    "children": [
      {
        "name": "Vector",
        "kind": "vector",
        "id": "8504:23446",
        "appearance": {
          "background": "#29b5e8"
        }
      }
    ]
  }
}
