{
  "_schema_version": 1,
  "slug": "user-single",
  "kit": "dskit",
  "synced_at": "2026-07-08T09:23:58.517Z",
  "source": {
    "fileKey": "l8biHxfarNi1I2RMvVxVOK",
    "nodeId": "7378:5029"
  },
  "quality": {
    "nodesTotal": 2,
    "nodesNormalized": 1,
    "ratio": 0.5,
    "degraded": [
      {
        "name": "user-single",
        "reason": "layoutMode:NONE"
      }
    ]
  },
  "root": {
    "name": "user-single",
    "kind": "container",
    "id": "7378:5029",
    "normalizable": false,
    "rawHint": {
      "layoutMode": "NONE",
      "x": -2070,
      "y": 640,
      "constraints": {
        "vertical": "TOP",
        "horizontal": "LEFT"
      }
    },
    "children": [
      {
        "name": "Union",
        "kind": "vector",
        "id": "19671:6268",
        "appearance": {
          "background": "#000000"
        }
      }
    ]
  }
}
