{
  "_schema_version": 1,
  "slug": "l-grid",
  "kit": "dskit",
  "synced_at": "2026-06-16T12:10:37.125Z",
  "source": {
    "fileKey": "l8biHxfarNi1I2RMvVxVOK",
    "nodeId": "12054:30598",
    "variant": "Property=Default"
  },
  "quality": {
    "nodesTotal": 18,
    "nodesNormalized": 17,
    "ratio": 0.94,
    "degraded": [
      {
        "name": "Property=Default",
        "reason": "layoutMode:NONE"
      }
    ]
  },
  "root": {
    "name": "Property=Default",
    "kind": "container",
    "normalizable": false,
    "rawHint": {
      "layoutMode": "NONE",
      "x": 2079,
      "y": 1240,
      "constraints": {
        "vertical": "TOP",
        "horizontal": "LEFT"
      }
    },
    "children": [
      {
        "name": "Columns",
        "kind": "container",
        "layout": {
          "axis": "row",
          "gap": "16px",
          "padding": {
            "top": "0px",
            "right": "24px",
            "bottom": "0px",
            "left": "24px"
          },
          "align": {
            "main": "start",
            "cross": "center"
          },
          "sizing": {
            "h": "fixed",
            "v": "fixed"
          }
        },
        "children": [
          {
            "name": "Column",
            "kind": "vector"
          },
          {
            "name": "Column",
            "kind": "vector"
          },
          {
            "name": "Column",
            "kind": "vector"
          },
          {
            "name": "Column",
            "kind": "vector"
          },
          {
            "name": "Column",
            "kind": "vector"
          },
          {
            "name": "Column",
            "kind": "vector"
          },
          {
            "name": "Column",
            "kind": "vector"
          },
          {
            "name": "Column",
            "kind": "vector"
          },
          {
            "name": "Column",
            "kind": "vector"
          },
          {
            "name": "Column",
            "kind": "vector"
          },
          {
            "name": "Column",
            "kind": "vector"
          },
          {
            "name": "Column",
            "kind": "vector"
          },
          {
            "name": "Column",
            "kind": "vector"
          },
          {
            "name": "Column",
            "kind": "vector"
          },
          {
            "name": "Column",
            "kind": "vector"
          },
          {
            "name": "Column",
            "kind": "vector"
          }
        ]
      }
    ]
  }
}
