{
  "_schema_version": 1,
  "slug": "link",
  "kit": "dskit",
  "synced_at": "2026-06-16T12:10:37.125Z",
  "source": {
    "fileKey": "l8biHxfarNi1I2RMvVxVOK",
    "nodeId": "8346:6897",
    "variant": "State=Enabled"
  },
  "quality": {
    "nodesTotal": 2,
    "nodesNormalized": 2,
    "ratio": 1,
    "degraded": []
  },
  "root": {
    "name": "State=Enabled",
    "kind": "container",
    "layout": {
      "axis": "row",
      "gap": "4px",
      "padding": {
        "top": "4px",
        "right": "4px",
        "bottom": "4px",
        "left": "4px"
      },
      "align": {
        "main": "center",
        "cross": "center"
      },
      "sizing": {
        "h": "hug",
        "v": "fixed"
      }
    },
    "children": [
      {
        "name": "Link",
        "kind": "text",
        "text": "Link"
      }
    ]
  }
}
