{
  "_schema_version": 1,
  "slug": "mail",
  "kit": "dskit",
  "synced_at": "2026-07-08T09:23:58.517Z",
  "source": {
    "fileKey": "l8biHxfarNi1I2RMvVxVOK",
    "nodeId": "8012:1308"
  },
  "quality": {
    "nodesTotal": 1,
    "nodesNormalized": 1,
    "ratio": 1,
    "degraded": []
  },
  "root": {
    "name": "mail",
    "kind": "container",
    "id": "8012:1308"
  }
}
