{
  "_schema_version": 1,
  "slug": "exploration",
  "kit": "dskit",
  "synced_at": "2026-07-08T09:23:58.517Z",
  "source": {
    "fileKey": "l8biHxfarNi1I2RMvVxVOK",
    "nodeId": "7294:702"
  },
  "quality": {
    "nodesTotal": 3,
    "nodesNormalized": 1,
    "ratio": 0.33,
    "degraded": [
      {
        "name": "exploration",
        "reason": "layoutMode:NONE"
      },
      {
        "name": "SVG",
        "reason": "layoutMode:NONE"
      }
    ]
  },
  "root": {
    "name": "exploration",
    "kind": "container",
    "id": "7294:702",
    "normalizable": false,
    "rawHint": {
      "layoutMode": "NONE",
      "x": -1527,
      "y": -200,
      "constraints": {
        "vertical": "TOP",
        "horizontal": "LEFT"
      }
    },
    "children": [
      {
        "name": "SVG",
        "kind": "container",
        "id": "14685:8454",
        "normalizable": false,
        "rawHint": {
          "layoutMode": "NONE",
          "x": -1525,
          "y": -198,
          "constraints": {
            "vertical": "SCALE",
            "horizontal": "SCALE"
          }
        },
        "children": [
          {
            "name": "Union",
            "kind": "vector",
            "tokenRefs": [
              "--zen-color-icon-default"
            ],
            "id": "14685:8501",
            "appearance": {
              "background": "#000000",
              "backgroundToken": "--zen-color-icon-default"
            }
          }
        ]
      }
    ]
  }
}
