{
  "_schema_version": 1,
  "slug": "empty-state",
  "kit": "dskit",
  "synced_at": "2026-06-30T10:29:57.517Z",
  "source": {
    "fileKey": "l8biHxfarNi1I2RMvVxVOK",
    "nodeId": "9230:22073",
    "variant": "Size=Large"
  },
  "quality": {
    "nodesTotal": 8,
    "nodesNormalized": 5,
    "ratio": 0.63,
    "degraded": []
  },
  "root": {
    "name": "Size=Large",
    "kind": "container",
    "layout": {
      "axis": "column",
      "gap": "16px",
      "padding": {
        "top": "0px",
        "right": "0px",
        "bottom": "0px",
        "left": "0px"
      },
      "align": {
        "main": "start",
        "cross": "center"
      },
      "sizing": {
        "h": "hug",
        "v": "hug"
      }
    },
    "children": [
      {
        "name": "Illustration",
        "kind": "instance",
        "unresolved": true,
        "props": {
          "Type": "Empty state large"
        }
      },
      {
        "name": "Text",
        "kind": "container",
        "layout": {
          "axis": "column",
          "gap": "4px",
          "padding": {
            "top": "0px",
            "right": "0px",
            "bottom": "0px",
            "left": "0px"
          },
          "align": {
            "main": "start",
            "cross": "center"
          },
          "sizing": {
            "h": "fill",
            "v": "hug"
          }
        },
        "children": [
          {
            "name": "Title",
            "kind": "text",
            "text": "No policies available"
          },
          {
            "name": "Body",
            "kind": "text",
            "text": "Create policies to define how your platform operates."
          }
        ]
      },
      {
        "name": "Actions",
        "kind": "container",
        "layout": {
          "axis": "row",
          "gap": "8px",
          "padding": {
            "top": "0px",
            "right": "0px",
            "bottom": "0px",
            "left": "0px"
          },
          "align": {
            "main": "start",
            "cross": "start"
          },
          "sizing": {
            "h": "hug",
            "v": "hug"
          }
        },
        "children": [
          {
            "name": "Button",
            "kind": "instance",
            "unresolved": true,
            "props": {
              "Label": "Learn more",
              "Show label": true,
              "Show trailing icon": false,
              "Show leading icon": false,
              "Intent": "Default",
              "Emphasis": "Ghost",
              "Size": "Default",
              "State": "Default"
            }
          },
          {
            "name": "Button",
            "kind": "instance",
            "unresolved": true,
            "props": {
              "Label": "Create policy",
              "Show label": true,
              "Show trailing icon": false,
              "Show leading icon": false,
              "Intent": "Default",
              "Emphasis": "Filled",
              "Size": "Default",
              "State": "Default"
            }
          }
        ]
      }
    ]
  }
}
