{
  "_schema_version": 1,
  "slug": "erwin-data-modeler",
  "kit": "dskit",
  "synced_at": "2026-07-08T09:23:58.517Z",
  "source": {
    "fileKey": "l8biHxfarNi1I2RMvVxVOK",
    "nodeId": "8400:25065"
  },
  "quality": {
    "nodesTotal": 2,
    "nodesNormalized": 1,
    "ratio": 0.5,
    "degraded": [
      {
        "name": "erwin-data-modeler",
        "reason": "layoutMode:NONE"
      },
      {
        "name": "erwin-data-modeler",
        "reason": "non-solid-fill:IMAGE"
      }
    ]
  },
  "root": {
    "name": "erwin-data-modeler",
    "kind": "container",
    "id": "8400:25065",
    "normalizable": false,
    "rawHint": {
      "layoutMode": "NONE",
      "x": 3150,
      "y": 1239,
      "constraints": {
        "vertical": "TOP",
        "horizontal": "LEFT"
      }
    },
    "children": [
      {
        "name": "erwin-data-modeler",
        "kind": "vector",
        "id": "8400:25066"
      }
    ]
  }
}
